<?xml version="1.0" encoding="UTF-8"?>
<nguoidung xmlns:xsi="http://www.w3.org/2001/XMLSchema-instance"
          xsi:noNamespaceSchemaLocation="music_xsd.xsd"
          nguoidung_id="1">
    <tendangnhap>minhhoa</tendangnhap>
    <email>minhhoa@example.com</email>
    <matkhau>123456</matkhau>
    <ngay_tao>2025-10-05</ngay_tao>

    <danhsachphat danhsach_id="1">
        <ten_danh_sach>Nhạc yêu thích</ten_danh_sach>
        <ngay_tao>2025-10-05</ngay_tao>

        <danhsach_baihat ds_bai_hat="1" thu_tu="1" ngay_them="2025-10-05">
            <baihat baihat_id="101">
                <tieu_de>Chạm khẽ tim anh một chút thôi</tieu_de>
                <thoi_luong>240</thoi_luong>
                <ngay_phat_hanh>2024-12-20</ngay_phat_hanh>
                <duong_dan_file>music/chamkhetimanh.mp3</duong_dan_file>

                <album album_id="10">
                    <ten_album>Ballad Việt</ten_album>
                    <ngay_phat_hanh>2024-12-15</ngay_phat_hanh>
                    <anh_bia>images/balladviet.jpg</anh_bia>
                </album>

                <nghesi nghesi_id="50">
                    <ten_nghesi>Noo Phước Thịnh</ten_nghesi>
                    <tieu_su>Ca sĩ nhạc trẻ Việt Nam</tieu_su>
                    <quoc_gia>Việt Nam</quoc_gia>
                </nghesi>

                <theloai theloai_id="5">
                    <ten_theloai>Pop Ballad</ten_theloai>
                    <mo_ta>Nhạc nhẹ, dễ nghe</mo_ta>
                </theloai>
            </baihat>
        </danhsach_baihat>
    </danhsachphat>
</nguoidung>
